name,description,location_name,latitude,longitude,address,start_time,end_time,city,primary_category,secondary_categories,thumbnail_image,additional_images,external_link,is_paid
INKwell Times Sq Harbor Club Grown Folk Fridays Afterwork,,The INKwell Harbor-Club Rooftop,40.76418434,-73.99751398,621 W 46th Street,2026-07-17T21:00:00Z,2026-07-18T03:00:00Z,new york,,,https://images.universe.com/5b28e3f6-cd74-40e1-9639-ae94d6a59b88/-/format/jpeg/-/scale_crop/1024x683/center/-/progressive/yes/-/inline/yes/,"https://s1.ticketm.net/dam/c/8cf/a6653880-7899-4f67-8067-1f95f4d158cf_124761_RETINA_LANDSCAPE_16_9.jpg,https://images.universe.com/5b28e3f6-cd74-40e1-9639-ae94d6a59b88/-/format/jpeg/-/scale_crop/640x427/center/-/progressive/yes/-/inline/yes/,https://images.universe.com/5b28e3f6-cd74-40e1-9639-ae94d6a59b88/-/format/jpeg/-/scale_crop/1024x576/center/-/progressive/yes/-/inline/yes/,https://images.universe.com/5b28e3f6-cd74-40e1-9639-ae94d6a59b88/-/format/jpeg/-/scale_crop/305x225/center/-/progressive/yes/-/inline/yes/,https://s1.ticketm.net/dam/c/8cf/a6653880-7899-4f67-8067-1f95f4d158cf_124761_EVENT_DETAIL_PAGE_16_9.jpg,https://s1.ticketm.net/dam/c/8cf/a6653880-7899-4f67-8067-1f95f4d158cf_124761_RETINA_PORTRAIT_16_9.jpg,https://s1.ticketm.net/dam/c/8cf/a6653880-7899-4f67-8067-1f95f4d158cf_124761_TABLET_LANDSCAPE_LARGE_16_9.jpg,https://images.universe.com/5b28e3f6-cd74-40e1-9639-ae94d6a59b88/-/format/jpeg/-/scale_crop/305x203/center/-/progressive/yes/-/inline/yes/,https://s1.ticketm.net/dam/c/8cf/a6653880-7899-4f67-8067-1f95f4d158cf_124761_RECOMENDATION_16_9.jpg",https://www.universe.com/events/inkwell-times-sq-harbor-club-grown-folk-fridays-afterwork-tickets-0TP798?ref=ticketmaster,false
Stella Cole,"To watch Stella Cole perform is to be transported back in time. Her sense of joy and wonder is infectious one look at her massive social media following makes this clear. Take a quick scroll through the comments of any of her many viral videos and youll see not only her irresistible charm, but an ability to expose fans of all ages to the wonders of the Great American Songbook, especially when these timeless stories are told honestly by an artist with an uncanny ability to transcend generations. On her highly anticipated debut recording, Stella is presented performing interpreting a collection of classics in a variety of settings, including many featuring an orchestra arranged by multiple Grammy-winner Alan Broadbent. Featuring songs made famous by everyone from Barbra Streisand (When the Sun Comes Out) and Judy Garland (The Boy Next Door and a classic re-interpretation of Over the Rainbow) to Billie Eilish (My Future) and Audrey Hepburn (Moon River of course!), it is sure to be one of the most impressive vocal recordings of 2024. Upon first hearing Stella Cole, one is immediately struck by her rich tone and extraordinary vocal control. However, what is particularly rare is her ability to interpret songs that were initially intended for actors in character in a direct, personally vulnerable way that connects to something within herself, placing her in the lineage of the greatest interpreters of the repertoire. Perhaps most exciting, to her many young fans, who have never heard these songs before, these are Stella Cole songs, which clearly makes her one of the most exciting artists of her generation.",Birdland Jazz Club,40.7590167,-73.9896861,315 West 44th Street ,2026-07-18T02:30:00Z,2026-07-18T03:45:00Z,new york,Music,Jazz,https://s1.ticketm.net/dam/a/478/d6254e45-717e-4de4-b5a9-1a8582cb6478_EVENT_DETAIL_PAGE_16_9.jpg,"https://s1.ticketm.net/dam/a/478/d6254e45-717e-4de4-b5a9-1a8582cb6478_TABLET_LANDSCAPE_3_2.jpg,https://s1.ticketm.net/dam/a/478/d6254e45-717e-4de4-b5a9-1a8582cb6478_RETINA_PORTRAIT_3_2.jpg,https://s1.ticketm.net/dam/a/478/d6254e45-717e-4de4-b5a9-1a8582cb6478_CUSTOM.jpg,https://s1.ticketm.net/dam/a/478/d6254e45-717e-4de4-b5a9-1a8582cb6478_TABLET_LANDSCAPE_LARGE_16_9.jpg,https://s1.ticketm.net/dam/a/478/d6254e45-717e-4de4-b5a9-1a8582cb6478_RETINA_PORTRAIT_16_9.jpg,https://s1.ticketm.net/dam/a/478/d6254e45-717e-4de4-b5a9-1a8582cb6478_RETINA_LANDSCAPE_16_9.jpg,https://s1.ticketm.net/dam/a/478/d6254e45-717e-4de4-b5a9-1a8582cb6478_RECOMENDATION_16_9.jpg,https://i.ticketweb.com/i/00/13/39/06/23_Edp.jpg?v=3,https://s1.ticketm.net/dam/a/478/d6254e45-717e-4de4-b5a9-1a8582cb6478_TABLET_LANDSCAPE_16_9.jpg,https://s1.ticketm.net/dam/a/478/d6254e45-717e-4de4-b5a9-1a8582cb6478_SOURCE,https://s1.ticketm.net/dam/a/478/d6254e45-717e-4de4-b5a9-1a8582cb6478_ARTIST_PAGE_3_2.jpg",https://www.ticketweb.com/event/stella-cole-birdland-jazz-club-tickets/14787743,true
HOUSE OF HEAVY CRUISE!,"HOUSE OF HEAVY NYC CONCERT CRUISE!!THE HEAVIEST PARTY IN AMERICA - House of Heavy is a night built for the fans who crave the pit, the riffs, the breakdowns, and the chaos, but are tired of waiting for the next tour to hit their city.Were bringing the energy of a packed metal show to you all year long: the nu-metal nostalgia, the alt-metal anthems, the metal-core breakdownsON A BOAT!Come scream along, and see the sights!!Throw down with friends, and lose yourself in the heaviest night thats floating around NYC!This is a HOUSE OF HEAVY CRUISE bringing you between the waves and all around NY Harbor for the best views in and of New York City the Greatest City in The World!! We will get up close and personal with the Statue of Liberty, take in the iconic skyline, cruise under the Brooklyn, Manhattan and Williamsburg Bridges and explore the East and Hudson Rivers! Experience HOUSE OF HEAVY ON A BOAT! Get your tickets NOW!This cruise is aboard THE LIBERTY BELLE and will depart from Pier 36 299 South Street. We will start boarding at 11:00 pm and departing promptly at 11:30pm, returning to the dock right around 2:30am! This event is strictly 21+We are *not* able to allow refunds if you miss the boat. So dont be late it sure aint pretty to be standin on the dock, watching the party sailing away! There are bars on board so you have options if you dance yourself into a thirst!There will also be food available for purchase Cash and Cards accepted!ATM on Board! If you have any questions about the show or your purchase, please contact Sancho Dominguez at sancho@rocksoff.com or check out our FAQ page on www.rocksoff.com Please note that all shows are 21 and over and ID will be required upon boarding the boat. LAST CALL for the boats is 5 minutes before departure After this time your tickets may be forfeited and you may not be able to board the boat, so *please arrive early*",The Liberty Belle - Rocks Off Concert Cruise,40.706355,-73.974563,299 South Street,2026-07-18T03:30:00Z,2026-07-18T06:30:00Z,new york,Music,Metal,https://s1.ticketm.net/dam/c/e7c/86478562-7218-4e8f-b9d4-8080fe168e7c_105581_TABLET_LANDSCAPE_16_9.jpg,"https://s1.ticketm.net/dam/c/e7c/86478562-7218-4e8f-b9d4-8080fe168e7c_105581_RETINA_PORTRAIT_16_9.jpg,https://s1.ticketm.net/dam/c/e7c/86478562-7218-4e8f-b9d4-8080fe168e7c_105581_RECOMENDATION_16_9.jpg,https://s1.ticketm.net/dam/c/e7c/86478562-7218-4e8f-b9d4-8080fe168e7c_105581_TABLET_LANDSCAPE_LARGE_16_9.jpg,https://s1.ticketm.net/dam/c/e7c/86478562-7218-4e8f-b9d4-8080fe168e7c_105581_TABLET_LANDSCAPE_3_2.jpg,https://s1.ticketm.net/dam/c/e7c/86478562-7218-4e8f-b9d4-8080fe168e7c_105581_CUSTOM.jpg,https://i.ticketweb.com/i/00/13/46/53/93_Edp.jpg?v=7,https://s1.ticketm.net/dam/c/e7c/86478562-7218-4e8f-b9d4-8080fe168e7c_105581_ARTIST_PAGE_3_2.jpg,https://s1.ticketm.net/dam/c/e7c/86478562-7218-4e8f-b9d4-8080fe168e7c_105581_RETINA_LANDSCAPE_16_9.jpg,https://s1.ticketm.net/dam/c/e7c/86478562-7218-4e8f-b9d4-8080fe168e7c_105581_EVENT_DETAIL_PAGE_16_9.jpg,https://s1.ticketm.net/dam/c/e7c/86478562-7218-4e8f-b9d4-8080fe168e7c_105581_RETINA_PORTRAIT_3_2.jpg",https://www.ticketweb.com/event/house-of-heavy-cruise-the-liberty-belle-tickets/14866093,true
  Live Band Country Karaoke,,Lucinda's,40.728329,-73.982199,169 Avenue A,2026-07-18T00:00:00Z,2026-07-18T03:30:00Z,new york,Music,Country,https://s1.ticketm.net/dam/c/677/c58dd0af-cda8-49b2-bdaf-068540c3a677_106541_RETINA_PORTRAIT_3_2.jpg,"https://s1.ticketm.net/dam/c/677/c58dd0af-cda8-49b2-bdaf-068540c3a677_106541_EVENT_DETAIL_PAGE_16_9.jpg,https://i.ticketweb.com/i/00/13/58/12/53_Edp.jpg?v=4,https://s1.ticketm.net/dam/c/677/c58dd0af-cda8-49b2-bdaf-068540c3a677_106541_TABLET_LANDSCAPE_3_2.jpg,https://s1.ticketm.net/dam/c/677/c58dd0af-cda8-49b2-bdaf-068540c3a677_106541_CUSTOM.jpg,https://s1.ticketm.net/dam/c/677/c58dd0af-cda8-49b2-bdaf-068540c3a677_106541_RETINA_PORTRAIT_16_9.jpg,https://s1.ticketm.net/dam/c/677/c58dd0af-cda8-49b2-bdaf-068540c3a677_106541_RECOMENDATION_16_9.jpg,https://s1.ticketm.net/dam/c/677/c58dd0af-cda8-49b2-bdaf-068540c3a677_106541_RETINA_LANDSCAPE_16_9.jpg,https://s1.ticketm.net/dam/c/677/c58dd0af-cda8-49b2-bdaf-068540c3a677_106541_TABLET_LANDSCAPE_16_9.jpg,https://s1.ticketm.net/dam/c/677/c58dd0af-cda8-49b2-bdaf-068540c3a677_106541_ARTIST_PAGE_3_2.jpg,https://s1.ticketm.net/dam/c/677/c58dd0af-cda8-49b2-bdaf-068540c3a677_106541_TABLET_LANDSCAPE_LARGE_16_9.jpg",https://www.ticketweb.com/event/-live-band-country-lucindas-tickets/14976663,true
Radio City Music Hall Tour Experience,"* 14 ticket limit per order. All sales are final - no refunds or exchanges. Discount code only applies to full-priced Adult tickets for select tours purchased on Ticketmaster.com. Offer not valid on not valid on child, senior or group rates. Offer may not be combined with any other offer or used on previously purchased tickets. Offer may be revoked or modified at any time without notice. Tour content, prices, dates and times are subject to change. Tour and Rockette are each subject to availability. Service charges apply to internet orders. Other restrictions may apply. If special accommodations are needed please call 212-465-6115 after ticket purchase. Radio City Music Hall and Stage Door are trademarks of MSG Holdings, L.P. or its affiliates.",Radio City Music Hall Tour Experience,40.75997700,-73.97997500,1260 Avenue of the Americas,,,new york,Miscellaneous,Undefined,https://s1.ticketm.net/dam/a/ad0/0c879104-ba01-492c-846f-379581c53ad0_RETINA_LANDSCAPE_16_9.jpg,"https://s1.ticketm.net/dam/a/ad0/0c879104-ba01-492c-846f-379581c53ad0_TABLET_LANDSCAPE_16_9.jpg,https://s1.ticketm.net/dam/a/ad0/0c879104-ba01-492c-846f-379581c53ad0_RECOMENDATION_16_9.jpg,https://s1.ticketm.net/dam/a/ad0/0c879104-ba01-492c-846f-379581c53ad0_CUSTOM.jpg,https://s1.ticketm.net/dam/a/ad0/0c879104-ba01-492c-846f-379581c53ad0_EVENT_DETAIL_PAGE_16_9.jpg,https://s1.ticketm.net/dam/a/ad0/0c879104-ba01-492c-846f-379581c53ad0_ARTIST_PAGE_3_2.jpg,https://s1.ticketm.net/dam/a/ad0/0c879104-ba01-492c-846f-379581c53ad0_RETINA_PORTRAIT_3_2.jpg,https://s1.ticketm.net/dam/a/ad0/0c879104-ba01-492c-846f-379581c53ad0_TABLET_LANDSCAPE_3_2.jpg,https://s1.ticketm.net/dam/a/ad0/0c879104-ba01-492c-846f-379581c53ad0_RETINA_PORTRAIT_16_9.jpg,https://s1.ticketm.net/dam/a/ad0/0c879104-ba01-492c-846f-379581c53ad0_TABLET_LANDSCAPE_LARGE_16_9.jpg,https://s1.ticketm.net/dam/a/ad0/0c879104-ba01-492c-846f-379581c53ad0_SOURCE",https://www.ticketmaster.com/radio-city-music-hall-tour-experience-new-york-new-york-07-17-2026/event/3C00645A08BA2373,false
Madison Square Garden Tour Experience,,Madison Square Garden,40.74970620,-73.99160060,7th Ave & 32nd Street,,,new york,Miscellaneous,Undefined,https://s1.ticketm.net/dam/a/476/7c230b41-d92a-4fd4-b6d1-dc6951ae8476_ARTIST_PAGE_3_2.jpg,"https://s1.ticketm.net/dam/a/476/7c230b41-d92a-4fd4-b6d1-dc6951ae8476_RETINA_PORTRAIT_16_9.jpg,https://s1.ticketm.net/dam/a/476/7c230b41-d92a-4fd4-b6d1-dc6951ae8476_RETINA_PORTRAIT_3_2.jpg,https://s1.ticketm.net/dam/a/476/7c230b41-d92a-4fd4-b6d1-dc6951ae8476_TABLET_LANDSCAPE_3_2.jpg,https://s1.ticketm.net/dam/a/476/7c230b41-d92a-4fd4-b6d1-dc6951ae8476_CUSTOM.jpg,https://s1.ticketm.net/dam/a/476/7c230b41-d92a-4fd4-b6d1-dc6951ae8476_SOURCE,https://s1.ticketm.net/dam/a/476/7c230b41-d92a-4fd4-b6d1-dc6951ae8476_RECOMENDATION_16_9.jpg,https://s1.ticketm.net/dam/a/476/7c230b41-d92a-4fd4-b6d1-dc6951ae8476_EVENT_DETAIL_PAGE_16_9.jpg,https://s1.ticketm.net/dam/a/476/7c230b41-d92a-4fd4-b6d1-dc6951ae8476_TABLET_LANDSCAPE_LARGE_16_9.jpg,https://s1.ticketm.net/dam/a/476/7c230b41-d92a-4fd4-b6d1-dc6951ae8476_RETINA_LANDSCAPE_16_9.jpg,https://s1.ticketm.net/dam/a/476/7c230b41-d92a-4fd4-b6d1-dc6951ae8476_TABLET_LANDSCAPE_16_9.jpg",https://www.ticketmaster.com/madison-square-garden-tour-experience-new-york-new-york-07-17-2026/event/3B0062F8B0B81270,false
Museum of Chinese in America Flex Admission,,Museum of Chinese in America,40.71953297,-73.99902914,215 Centre Street,2026-04-29T15:00:00Z,2026-12-31T23:00:00Z,new york,Miscellaneous,Undefined,https://s1.ticketm.net/dam/c/03e/e15ef00f-2c87-4421-ae61-d740851a703e_105891_RETINA_LANDSCAPE_16_9.jpg,"https://images.universe.com/87c12cd6-3143-4efa-9b0f-29b4ebc9321d/-/resize/1200x/-/crop/791x791/105,4/-/format/jpeg/-/scale_crop/1024x683/center/-/progressive/yes/-/inline/yes/,https://s1.ticketm.net/dam/c/03e/e15ef00f-2c87-4421-ae61-d740851a703e_105891_EVENT_DETAIL_PAGE_16_9.jpg,https://s1.ticketm.net/dam/c/03e/e15ef00f-2c87-4421-ae61-d740851a703e_105891_RETINA_PORTRAIT_16_9.jpg,https://images.universe.com/87c12cd6-3143-4efa-9b0f-29b4ebc9321d/-/resize/1200x/-/crop/791x791/105,4/-/format/jpeg/-/scale_crop/1024x576/center/-/progressive/yes/-/inline/yes/,https://images.universe.com/87c12cd6-3143-4efa-9b0f-29b4ebc9321d/-/resize/1200x/-/crop/791x791/105,4/-/format/jpeg/-/scale_crop/640x427/center/-/progressive/yes/-/inline/yes/,https://s1.ticketm.net/dam/c/03e/e15ef00f-2c87-4421-ae61-d740851a703e_105891_RECOMENDATION_16_9.jpg,https://images.universe.com/87c12cd6-3143-4efa-9b0f-29b4ebc9321d/-/resize/1200x/-/crop/791x791/105,4/-/format/jpeg/-/scale_crop/305x225/center/-/progressive/yes/-/inline/yes/,https://images.universe.com/87c12cd6-3143-4efa-9b0f-29b4ebc9321d/-/resize/1200x/-/crop/791x791/105,4/-/format/jpeg/-/scale_crop/305x203/center/-/progressive/yes/-/inline/yes/,https://s1.ticketm.net/dam/c/03e/e15ef00f-2c87-4421-ae61-d740851a703e_105891_TABLET_LANDSCAPE_LARGE_16_9.jpg",https://www.universe.com/events/museum-of-chinese-in-america-flex-admission-tickets-B9N1ZL?ref=ticketmaster,false
