name,description,location_name,latitude,longitude,address,start_time,end_time,city,primary_category,secondary_categories,thumbnail_image,additional_images,external_link,is_paid
UMI with Live Band,"$20 Minimum Per PersonFull Bar & Dinner MenuNO REFUNDS OR EXCHANGES.All seating is first come, first served. Bar Area seating is limited and first come first served. When all available seats are occupied, the remaining bar area is standing room only.Table Seating is all ages, Bar Area is 21+. Bar Area tickets for patrons under 21 will not be honored. Group Reservations:Groups larger than 8 must purchase a group package at groupsales@bluenote.net, or by calling 212.475.8592.Groups larger than 8 without a group package will be subject to group surcharges added to your bill. Groups arriving late or separately are not guaranteed to be seated together. All seating is first come, first served. Arrive early for best seats.We are not affiliated with any third-party ticket sellers. Tickets purchased directly through our official website or TicketWeb are the only authorized sources. We cannot guarantee the validity of tickets purchased through unauthorized sources. To protect against fraud and unauthorized ticket sales, management may require verification of the original purchase method, including presenting the credit card used for purchase and matching photo identification upon entry.",Blue Note Jazz Club,40.730940,-74.000650,131 W. 3rd St,2026-06-26T02:30:00Z,,new york,Music,R&B,https://s1.ticketm.net/dam/a/add/0ef220ed-3dd4-405d-a690-1881ce30cadd_EVENT_DETAIL_PAGE_16_9.jpg,"https://s1.ticketm.net/dam/a/add/0ef220ed-3dd4-405d-a690-1881ce30cadd_SOURCE,https://s1.ticketm.net/dam/a/ee7/4a4e218f-bd00-499f-aa74-947ea5e71ee7_SOURCE,https://s1.ticketm.net/dam/a/add/0ef220ed-3dd4-405d-a690-1881ce30cadd_CUSTOM.jpg,https://s1.ticketm.net/dam/a/add/0ef220ed-3dd4-405d-a690-1881ce30cadd_RECOMENDATION_16_9.jpg,https://s1.ticketm.net/dam/a/add/0ef220ed-3dd4-405d-a690-1881ce30cadd_ARTIST_PAGE_3_2.jpg,https://s1.ticketm.net/dam/a/add/0ef220ed-3dd4-405d-a690-1881ce30cadd_RETINA_PORTRAIT_16_9.jpg,https://s1.ticketm.net/dam/a/add/0ef220ed-3dd4-405d-a690-1881ce30cadd_TABLET_LANDSCAPE_16_9.jpg,https://s1.ticketm.net/dam/a/add/0ef220ed-3dd4-405d-a690-1881ce30cadd_RETINA_LANDSCAPE_16_9.jpg,https://i.ticketweb.com/i/00/13/37/43/93_Edp.jpg?v=8,https://s1.ticketm.net/dam/a/add/0ef220ed-3dd4-405d-a690-1881ce30cadd_TABLET_LANDSCAPE_3_2.jpg",https://www.ticketweb.com/event/umi-with-live-band-blue-note-jazz-club-tickets/14768893,true
Cyrille Aimée,"Cyrille Aime grew up in a multilingual household full of music where dancing was an everyday activity, soundtracked by the Afro-Caribbean sounds of her mothers native Dominican Republic. The family home was in Samois-sur-Seine, the location of the Django Reinhardt Festival, and the teenage Cyrille would climb out of her bendroom window at night to mingle with the players, igniting a passion for jazz. Moving to New York City, her talents quickly gained her a reputation among her peers as a matchless interpreter of song. She performed and recorded with Roy Hargrove and stole the show in front of the notoriously hard-to-please crowd at the Harlem Apollo. Steven Sondheim invited her to star in a tribute at New York Citys City Centre, backed by Wynton Marsalis. Her 2019 album Move On featured versions of Sondheims songs which received praise from Sondheim himself, and her version of Marry Me a Little was nominated for a 2019 GRAMMY award. At the height of her New York success, new horizons beckoned. Visiting New Orleans, she fell in love with the energy and diversity of the city and made it her home. Linking back to New York to connect up all the dots, she teamed up with producer/multi-instrumentalist Jake Sherman, and together they created her latest album, A Fleur de Peau, to be released on a new label, the London-based imprit Whirlwind Records.Combining the depth and sophistication of jazz, the immediacy of pop, the irrepressible dance rhythms of the Caribbean, its more intimate and more accessible than anything Cyrille has done before.",Birdland Jazz Club,40.7590167,-73.9896861,315 West 44th Street ,2026-06-26T01:30:00Z,2026-06-26T02:45:00Z,new york,Music,Jazz,https://s1.ticketm.net/dam/c/bea/03d47f66-d37b-4aca-aa17-0135be64dbea_105801_RETINA_PORTRAIT_16_9.jpg,"https://s1.ticketm.net/dam/c/bea/03d47f66-d37b-4aca-aa17-0135be64dbea_105801_RETINA_LANDSCAPE_16_9.jpg,https://s1.ticketm.net/dam/c/bea/03d47f66-d37b-4aca-aa17-0135be64dbea_105801_EVENT_DETAIL_PAGE_16_9.jpg,https://s1.ticketm.net/dam/c/bea/03d47f66-d37b-4aca-aa17-0135be64dbea_105801_RECOMENDATION_16_9.jpg,https://i.ticketweb.com/i/00/12/88/61/64_Edp.jpg?v=3,https://s1.ticketm.net/dam/c/bea/03d47f66-d37b-4aca-aa17-0135be64dbea_105801_ARTIST_PAGE_3_2.jpg,https://s1.ticketm.net/dam/c/bea/03d47f66-d37b-4aca-aa17-0135be64dbea_105801_TABLET_LANDSCAPE_3_2.jpg,https://s1.ticketm.net/dam/c/bea/03d47f66-d37b-4aca-aa17-0135be64dbea_105801_CUSTOM.jpg,https://s1.ticketm.net/dam/c/bea/03d47f66-d37b-4aca-aa17-0135be64dbea_105801_RETINA_PORTRAIT_3_2.jpg,https://s1.ticketm.net/dam/c/bea/03d47f66-d37b-4aca-aa17-0135be64dbea_105801_TABLET_LANDSCAPE_16_9.jpg,https://s1.ticketm.net/dam/c/bea/03d47f66-d37b-4aca-aa17-0135be64dbea_105801_TABLET_LANDSCAPE_LARGE_16_9.jpg",https://www.ticketweb.com/event/cyrille-aime-birdland-jazz-club-tickets/14167744,true
Silverose,SILVEROSE EP RELEASEwith MangodogIsrael Yanir Tiffadelic Clearjaw,Night Club 101,40.725911,-73.984043,101 Avenue A,2026-06-26T02:00:00Z,,new york,Music,Other,https://s1.ticketm.net/dam/c/060/c5c08e7a-9912-456c-a060-2758be94e060_105881_RETINA_LANDSCAPE_16_9.jpg,"https://s1.ticketm.net/dam/c/060/c5c08e7a-9912-456c-a060-2758be94e060_105881_TABLET_LANDSCAPE_LARGE_16_9.jpg,https://s1.ticketm.net/dam/c/060/c5c08e7a-9912-456c-a060-2758be94e060_105881_RETINA_PORTRAIT_16_9.jpg,https://s1.ticketm.net/dam/c/060/c5c08e7a-9912-456c-a060-2758be94e060_105881_TABLET_LANDSCAPE_16_9.jpg,https://s1.ticketm.net/dam/c/060/c5c08e7a-9912-456c-a060-2758be94e060_105881_ARTIST_PAGE_3_2.jpg,https://i.ticketweb.com/i/00/12/91/58/74_Edp.jpg?v=4,https://s1.ticketm.net/dam/c/060/c5c08e7a-9912-456c-a060-2758be94e060_105881_TABLET_LANDSCAPE_3_2.jpg,https://s1.ticketm.net/dam/c/060/c5c08e7a-9912-456c-a060-2758be94e060_105881_CUSTOM.jpg,https://s1.ticketm.net/dam/c/060/c5c08e7a-9912-456c-a060-2758be94e060_105881_RECOMENDATION_16_9.jpg,https://s1.ticketm.net/dam/c/060/c5c08e7a-9912-456c-a060-2758be94e060_105881_EVENT_DETAIL_PAGE_16_9.jpg,https://s1.ticketm.net/dam/c/060/c5c08e7a-9912-456c-a060-2758be94e060_105881_RETINA_PORTRAIT_3_2.jpg",https://www.ticketweb.com/event/silverose-night-club-101-tickets/14199004,true
NoFun FestPass,"Get access to all five weeks of NoFun Fest, every Monday in June!",Berlin,40.722974,-73.986080,The Lower-Level of 2A Bar,2026-06-01T23:00:00Z,2026-06-29T04:00:00Z,new york,Music,Alternative,https://s1.ticketm.net/dam/c/f50/96fa13be-e395-429b-8558-a51bb9054f50_105951_TABLET_LANDSCAPE_LARGE_16_9.jpg,"https://s1.ticketm.net/dam/c/797/5e693c26-2881-4776-8f0c-3aa94bfa3797_106511_RETINA_PORTRAIT_3_2.jpg,https://s1.ticketm.net/dam/c/797/5e693c26-2881-4776-8f0c-3aa94bfa3797_106511_TABLET_LANDSCAPE_3_2.jpg,https://s1.ticketm.net/dam/c/797/5e693c26-2881-4776-8f0c-3aa94bfa3797_106511_ARTIST_PAGE_3_2.jpg,https://i.ticketweb.com/i/00/13/53/60/73_Edp.jpg?v=2,https://s1.ticketm.net/dam/c/797/5e693c26-2881-4776-8f0c-3aa94bfa3797_106511_EVENT_DETAIL_PAGE_16_9.jpg,https://s1.ticketm.net/dam/c/797/5e693c26-2881-4776-8f0c-3aa94bfa3797_106511_RETINA_LANDSCAPE_16_9.jpg,https://s1.ticketm.net/dam/c/797/5e693c26-2881-4776-8f0c-3aa94bfa3797_106511_RETINA_PORTRAIT_16_9.jpg,https://s1.ticketm.net/dam/c/797/5e693c26-2881-4776-8f0c-3aa94bfa3797_106511_CUSTOM.jpg,https://s1.ticketm.net/dam/c/797/5e693c26-2881-4776-8f0c-3aa94bfa3797_106511_RECOMENDATION_16_9.jpg,https://s1.ticketm.net/dam/c/797/5e693c26-2881-4776-8f0c-3aa94bfa3797_106511_TABLET_LANDSCAPE_16_9.jpg",https://www.ticketweb.com/event/nofun-festpass-berlin-tickets/14940623,true
Museum of Chinese in America Flex Admission,,Museum of Chinese in America,40.71953297,-73.99902914,215 Centre Street,2026-04-29T15:00:00Z,2026-12-31T23:00:00Z,new york,Miscellaneous,Undefined,https://s1.ticketm.net/dam/c/03e/e15ef00f-2c87-4421-ae61-d740851a703e_105891_RETINA_LANDSCAPE_16_9.jpg,"https://images.universe.com/87c12cd6-3143-4efa-9b0f-29b4ebc9321d/-/resize/1200x/-/crop/791x791/105,4/-/format/jpeg/-/scale_crop/1024x683/center/-/progressive/yes/-/inline/yes/,https://s1.ticketm.net/dam/c/03e/e15ef00f-2c87-4421-ae61-d740851a703e_105891_EVENT_DETAIL_PAGE_16_9.jpg,https://s1.ticketm.net/dam/c/03e/e15ef00f-2c87-4421-ae61-d740851a703e_105891_RETINA_PORTRAIT_16_9.jpg,https://images.universe.com/87c12cd6-3143-4efa-9b0f-29b4ebc9321d/-/resize/1200x/-/crop/791x791/105,4/-/format/jpeg/-/scale_crop/1024x576/center/-/progressive/yes/-/inline/yes/,https://images.universe.com/87c12cd6-3143-4efa-9b0f-29b4ebc9321d/-/resize/1200x/-/crop/791x791/105,4/-/format/jpeg/-/scale_crop/640x427/center/-/progressive/yes/-/inline/yes/,https://s1.ticketm.net/dam/c/03e/e15ef00f-2c87-4421-ae61-d740851a703e_105891_RECOMENDATION_16_9.jpg,https://images.universe.com/87c12cd6-3143-4efa-9b0f-29b4ebc9321d/-/resize/1200x/-/crop/791x791/105,4/-/format/jpeg/-/scale_crop/305x225/center/-/progressive/yes/-/inline/yes/,https://images.universe.com/87c12cd6-3143-4efa-9b0f-29b4ebc9321d/-/resize/1200x/-/crop/791x791/105,4/-/format/jpeg/-/scale_crop/305x203/center/-/progressive/yes/-/inline/yes/,https://s1.ticketm.net/dam/c/03e/e15ef00f-2c87-4421-ae61-d740851a703e_105891_TABLET_LANDSCAPE_LARGE_16_9.jpg",https://www.universe.com/events/museum-of-chinese-in-america-flex-admission-tickets-B9N1ZL?ref=ticketmaster,false
