name,description,location_name,latitude,longitude,address,start_time,end_time,city,primary_category,secondary_categories,thumbnail_image,additional_images,external_link,is_paid
Perfect Crime,,The Theater Center,40.76161629,-73.98448955,210 W. 50th Street,2026-07-22T00:00:00Z,,new york,Arts & Theatre,Theatre,https://s1.ticketm.net/dam/a/29c/eeecf849-409d-45e6-85a6-995ec0ed929c_104361_ARTIST_PAGE_3_2.jpg,"https://s1.ticketm.net/dam/a/29c/eeecf849-409d-45e6-85a6-995ec0ed929c_104361_EVENT_DETAIL_PAGE_16_9.jpg,https://s1.ticketm.net/dam/a/29c/eeecf849-409d-45e6-85a6-995ec0ed929c_104361_RECOMENDATION_16_9.jpg,https://s1.ticketm.net/dam/a/29c/eeecf849-409d-45e6-85a6-995ec0ed929c_104361_TABLET_LANDSCAPE_16_9.jpg,https://s1.ticketm.net/dam/a/29c/eeecf849-409d-45e6-85a6-995ec0ed929c_104361_TABLET_LANDSCAPE_LARGE_16_9.jpg,https://s1.ticketm.net/dam/a/29c/eeecf849-409d-45e6-85a6-995ec0ed929c_104361_TABLET_LANDSCAPE_3_2.jpg,https://s1.ticketm.net/dam/a/29c/eeecf849-409d-45e6-85a6-995ec0ed929c_104361_RETINA_PORTRAIT_16_9.jpg,https://s1.ticketm.net/dam/a/29c/eeecf849-409d-45e6-85a6-995ec0ed929c_104361_RETINA_PORTRAIT_3_2.jpg,https://s1.ticketm.net/dam/a/29c/eeecf849-409d-45e6-85a6-995ec0ed929c_104361_RETINA_LANDSCAPE_16_9.jpg,https://s1.ticketm.net/dam/a/29c/eeecf849-409d-45e6-85a6-995ec0ed929c_104361_CUSTOM.jpg,https://s1.ticketm.net/dam/a/29c/eeecf849-409d-45e6-85a6-995ec0ed929c_SOURCE",https://www.ticketmaster.com/perfect-crime-new-york-new-york-07-21-2026/event/3000648E84231B75,false
Vince Giordano and the Nighthawks,"In his Birdland Theater residency, GRAMMY Award winner, New York native, and multi-instrumentalist Vince Giordano leads The Nighthawks -- an 11-piece band who have set the standard for recreating authentic jazz sounds of the 1920s and beyond. In addition to club and concert appearances around the world, the band has provided period soundtracks for film and television productions including The Cotton Club, The Aviator, Finding Forrester, Revolutionary Road, Cafe Society, HBOs Boardwalk Empire, The Marvelous Mrs. Maisel, the upcoming Martin Scorsese film Killers of The Flower Moon, and many more.",Birdland Theater,40.7590167,-73.9896861,315 West 44th Street,2026-07-22T00:30:00Z,2026-07-22T01:45:00Z,new york,Music,Rock,https://s1.ticketm.net/dam/c/fbc/b293c0ad-c904-4215-bc59-8d7f2414dfbc_106141_EVENT_DETAIL_PAGE_16_9.jpg,"https://s1.ticketm.net/dam/c/fbc/b293c0ad-c904-4215-bc59-8d7f2414dfbc_106141_CUSTOM.jpg,https://s1.ticketm.net/dam/c/fbc/b293c0ad-c904-4215-bc59-8d7f2414dfbc_106141_RETINA_LANDSCAPE_16_9.jpg,https://s1.ticketm.net/dam/c/fbc/b293c0ad-c904-4215-bc59-8d7f2414dfbc_106141_TABLET_LANDSCAPE_3_2.jpg,https://s1.ticketm.net/dam/c/fbc/b293c0ad-c904-4215-bc59-8d7f2414dfbc_106141_TABLET_LANDSCAPE_16_9.jpg,https://s1.ticketm.net/dam/c/fbc/b293c0ad-c904-4215-bc59-8d7f2414dfbc_106141_TABLET_LANDSCAPE_LARGE_16_9.jpg,https://s1.ticketm.net/dam/c/fbc/b293c0ad-c904-4215-bc59-8d7f2414dfbc_106141_RETINA_PORTRAIT_16_9.jpg,https://s1.ticketm.net/dam/c/fbc/b293c0ad-c904-4215-bc59-8d7f2414dfbc_106141_RECOMENDATION_16_9.jpg,https://s1.ticketm.net/dam/c/fbc/b293c0ad-c904-4215-bc59-8d7f2414dfbc_106141_ARTIST_PAGE_3_2.jpg,https://i.ticketweb.com/i/00/13/36/18/83_Edp.jpg?v=3",https://www.ticketweb.com/event/vince-giordano-and-the-nighthawks-birdland-theater-tickets/14751053,true
Berhana,"Berhana EP 10 Year Anniversary Show$20 Minimum Per PersonFull Bar & Dinner MenuNO REFUNDS OR EXCHANGES.All seating is first come, first served. Bar Area seating is limited and first come first served. When all available seats are occupied, the remaining bar area is standing room only.Table Seating is all ages, Bar Area is 21+. Bar Area tickets for patrons under 21 will not be honored. Group Reservations:Groups larger than 8 must purchase a group package at club@bluenote.net, or by calling 212.475.8592.Groups larger than 8 without a group package will be subject to group surcharges added to your bill. Groups arriving late or separately are not guaranteed to be seated together. All seating is first come, first served. Arrive early for best seats.We are not affiliated with any third-party ticket sellers. Tickets purchased directly through our official website or TicketWeb are the only authorized sources. We cannot guarantee the validity of tickets purchased through unauthorized sources. To protect against fraud and unauthorized ticket sales, management may require verification of the original purchase method, including presenting the credit card used for purchase and matching photo identification upon entry.",Blue Note Jazz Club,40.730940,-74.000650,131 W. 3rd St,2026-07-22T00:00:00Z,,new york,Music,R&B,https://s1.ticketm.net/dam/a/6db/3f096e64-564f-43f7-8b09-c8d259de16db_RECOMENDATION_16_9.jpg,"https://s1.ticketm.net/dam/a/6db/3f096e64-564f-43f7-8b09-c8d259de16db_RETINA_PORTRAIT_16_9.jpg,https://s1.ticketm.net/dam/a/6db/3f096e64-564f-43f7-8b09-c8d259de16db_TABLET_LANDSCAPE_3_2.jpg,https://s1.ticketm.net/dam/a/6db/3f096e64-564f-43f7-8b09-c8d259de16db_RETINA_LANDSCAPE_16_9.jpg,https://i.ticketweb.com/i/00/13/56/04/83_Edp.jpg?v=6,https://s1.ticketm.net/dam/a/6db/3f096e64-564f-43f7-8b09-c8d259de16db_TABLET_LANDSCAPE_LARGE_16_9.jpg,https://s1.ticketm.net/dam/a/6db/3f096e64-564f-43f7-8b09-c8d259de16db_CUSTOM.jpg,https://s1.ticketm.net/dam/a/6db/3f096e64-564f-43f7-8b09-c8d259de16db_TABLET_LANDSCAPE_16_9.jpg,https://s1.ticketm.net/dam/a/6db/3f096e64-564f-43f7-8b09-c8d259de16db_EVENT_DETAIL_PAGE_16_9.jpg,https://s1.ticketm.net/dam/a/6db/3f096e64-564f-43f7-8b09-c8d259de16db_ARTIST_PAGE_3_2.jpg,https://s1.ticketm.net/dam/a/6db/3f096e64-564f-43f7-8b09-c8d259de16db_SOURCE",https://www.ticketweb.com/event/berhana-blue-note-jazz-club-tickets/14953813,true
"Gerry Gibbs Dream Band ft. Gary Bartz, Randy Brecker, Buster Williams, Cyrus Chestnut","Composer, Arranger, Bandleader Gerry Gibbs presents the 2026 edition of The Dream Band for five nights at Birdland Jazz Club featuring NEA Jazz Masters saxophonist Gary Bartz, trumpeter Randy Brecker, bassist Buster Williams, with acclaimed pianist Cyrus Chestnut.With 17 solo albums and multiple GRAMMY nominations, drummer Gerry Gibbs has performed, toured or recorded with a whos who in the music world such as Alice Coltrane, McCoy Tyner, Chick Corea, Flying Lotus, Kamasi Washington, Thundercat, Sarah Vaughn, Stanley Clarke, Brad Mehldau, Mike Stern, Joe Henderson, Donald Byrd, Parliament Funkadelics, Joey Defransesco, Ornette Coleman, Woody Shaw, Sam Rivers, Clark Terry, James Moody, Dewey Redman and many more. NEA Jazz Master and legendary alto saxophonist Gary Bartz has worked with jazz icons including Miles Davis, Max Roach, Charles Mingus, and Art Blakey.Celebrated seven-time GRAMMY Award winner and NEA Jazz Master trumpeter Randy Brecker was a foundational figure in jazz-fusion. He is widely recognized for his work with the Brecker Brothers and his extensive contributions to the recordings of artists ranging from Frank Sinatra to Parliament-Funkadelic.Highly acclaimed jazz pianist and composer Cyrus Chestnut signed to Atlantic Records and accompanied legends Betty Carter, Jimmy Heath, and James Moody on his way to being called, the best jazz pianist of his generation, by Time Magazine.Legendary bassist and NEA Jazz Master Buster Williams has been at the forefront of the jazz scene since the 1960s when he performed and recorded with Miles Davis, Herbie Hancock, and Nancy Wilson.",Birdland Jazz Club,40.7590167,-73.9896861,315 West 44th Street ,2026-07-21T23:00:00Z,2026-07-22T00:15:00Z,new york,Music,Jazz,https://s1.ticketm.net/dam/c/bea/03d47f66-d37b-4aca-aa17-0135be64dbea_105801_RECOMENDATION_16_9.jpg,"https://s1.ticketm.net/dam/c/bea/03d47f66-d37b-4aca-aa17-0135be64dbea_105801_TABLET_LANDSCAPE_LARGE_16_9.jpg,https://s1.ticketm.net/dam/c/bea/03d47f66-d37b-4aca-aa17-0135be64dbea_105801_RETINA_PORTRAIT_3_2.jpg,https://s1.ticketm.net/dam/c/bea/03d47f66-d37b-4aca-aa17-0135be64dbea_105801_ARTIST_PAGE_3_2.jpg,https://s1.ticketm.net/dam/c/bea/03d47f66-d37b-4aca-aa17-0135be64dbea_105801_TABLET_LANDSCAPE_3_2.jpg,https://s1.ticketm.net/dam/c/bea/03d47f66-d37b-4aca-aa17-0135be64dbea_105801_RETINA_PORTRAIT_16_9.jpg,https://s1.ticketm.net/dam/c/bea/03d47f66-d37b-4aca-aa17-0135be64dbea_105801_EVENT_DETAIL_PAGE_16_9.jpg,https://s1.ticketm.net/dam/c/bea/03d47f66-d37b-4aca-aa17-0135be64dbea_105801_CUSTOM.jpg,https://s1.ticketm.net/dam/c/bea/03d47f66-d37b-4aca-aa17-0135be64dbea_105801_TABLET_LANDSCAPE_16_9.jpg,https://s1.ticketm.net/dam/c/bea/03d47f66-d37b-4aca-aa17-0135be64dbea_105801_RETINA_LANDSCAPE_16_9.jpg,https://i.ticketweb.com/i/00/13/46/63/73_Edp.jpg?v=4",https://www.ticketweb.com/event/gerry-gibbs-dream-band-ft-birdland-jazz-club-tickets/14867003,true
Live Weekly Bluegrass with  Allison Kelly,,Lucinda's,40.728329,-73.982199,169 Avenue A,2026-07-22T00:00:00Z,2026-07-22T03:00:00Z,new york,Music,Country,https://s1.ticketm.net/dam/c/677/c58dd0af-cda8-49b2-bdaf-068540c3a677_106541_RETINA_PORTRAIT_3_2.jpg,"https://s1.ticketm.net/dam/c/677/c58dd0af-cda8-49b2-bdaf-068540c3a677_106541_EVENT_DETAIL_PAGE_16_9.jpg,https://s1.ticketm.net/dam/c/677/c58dd0af-cda8-49b2-bdaf-068540c3a677_106541_TABLET_LANDSCAPE_3_2.jpg,https://s1.ticketm.net/dam/c/677/c58dd0af-cda8-49b2-bdaf-068540c3a677_106541_CUSTOM.jpg,https://s1.ticketm.net/dam/c/677/c58dd0af-cda8-49b2-bdaf-068540c3a677_106541_RETINA_PORTRAIT_16_9.jpg,https://s1.ticketm.net/dam/c/677/c58dd0af-cda8-49b2-bdaf-068540c3a677_106541_RECOMENDATION_16_9.jpg,https://s1.ticketm.net/dam/c/677/c58dd0af-cda8-49b2-bdaf-068540c3a677_106541_RETINA_LANDSCAPE_16_9.jpg,https://i.ticketweb.com/i/00/12/70/75/34_Edp.jpg?v=8,https://s1.ticketm.net/dam/c/677/c58dd0af-cda8-49b2-bdaf-068540c3a677_106541_TABLET_LANDSCAPE_16_9.jpg,https://s1.ticketm.net/dam/c/677/c58dd0af-cda8-49b2-bdaf-068540c3a677_106541_ARTIST_PAGE_3_2.jpg,https://s1.ticketm.net/dam/c/677/c58dd0af-cda8-49b2-bdaf-068540c3a677_106541_TABLET_LANDSCAPE_LARGE_16_9.jpg",https://www.ticketweb.com/event/live-weekly-bluegrass-with-lucindas-tickets/13950664,true
Museum of Chinese in America Flex Admission,,Museum of Chinese in America,40.71953297,-73.99902914,215 Centre Street,2026-04-29T15:00:00Z,2026-12-31T23:00:00Z,new york,Miscellaneous,Undefined,https://s1.ticketm.net/dam/c/03e/e15ef00f-2c87-4421-ae61-d740851a703e_105891_RETINA_LANDSCAPE_16_9.jpg,"https://images.universe.com/87c12cd6-3143-4efa-9b0f-29b4ebc9321d/-/resize/1200x/-/crop/791x791/105,4/-/format/jpeg/-/scale_crop/1024x683/center/-/progressive/yes/-/inline/yes/,https://s1.ticketm.net/dam/c/03e/e15ef00f-2c87-4421-ae61-d740851a703e_105891_EVENT_DETAIL_PAGE_16_9.jpg,https://s1.ticketm.net/dam/c/03e/e15ef00f-2c87-4421-ae61-d740851a703e_105891_RETINA_PORTRAIT_16_9.jpg,https://images.universe.com/87c12cd6-3143-4efa-9b0f-29b4ebc9321d/-/resize/1200x/-/crop/791x791/105,4/-/format/jpeg/-/scale_crop/1024x576/center/-/progressive/yes/-/inline/yes/,https://images.universe.com/87c12cd6-3143-4efa-9b0f-29b4ebc9321d/-/resize/1200x/-/crop/791x791/105,4/-/format/jpeg/-/scale_crop/640x427/center/-/progressive/yes/-/inline/yes/,https://s1.ticketm.net/dam/c/03e/e15ef00f-2c87-4421-ae61-d740851a703e_105891_RECOMENDATION_16_9.jpg,https://images.universe.com/87c12cd6-3143-4efa-9b0f-29b4ebc9321d/-/resize/1200x/-/crop/791x791/105,4/-/format/jpeg/-/scale_crop/305x225/center/-/progressive/yes/-/inline/yes/,https://images.universe.com/87c12cd6-3143-4efa-9b0f-29b4ebc9321d/-/resize/1200x/-/crop/791x791/105,4/-/format/jpeg/-/scale_crop/305x203/center/-/progressive/yes/-/inline/yes/,https://s1.ticketm.net/dam/c/03e/e15ef00f-2c87-4421-ae61-d740851a703e_105891_TABLET_LANDSCAPE_LARGE_16_9.jpg",https://www.universe.com/events/museum-of-chinese-in-america-flex-admission-tickets-B9N1ZL?ref=ticketmaster,false
Finn Wolfhard (16 and Over),,Webster Hall,40.731602000,-73.989098000,125 East 11th Street,2026-07-22T00:00:00Z,,new york,Undefined,,https://s1.ticketm.net/dam/c/f51/ee785ed6-f806-4195-98f4-69f67e09df51_106201_RETINA_PORTRAIT_3_2.jpg,"https://s1.ticketm.net/dam/c/f51/ee785ed6-f806-4195-98f4-69f67e09df51_106201_TABLET_LANDSCAPE_3_2.jpg,https://s1.ticketm.net/dam/c/f51/ee785ed6-f806-4195-98f4-69f67e09df51_106201_ARTIST_PAGE_3_2.jpg,https://s1.ticketm.net/dam/c/f51/ee785ed6-f806-4195-98f4-69f67e09df51_106201_EVENT_DETAIL_PAGE_16_9.jpg,https://s1.ticketm.net/dam/c/f51/ee785ed6-f806-4195-98f4-69f67e09df51_106201_RETINA_LANDSCAPE_16_9.jpg,https://s1.ticketm.net/dam/c/f51/ee785ed6-f806-4195-98f4-69f67e09df51_106201_TABLET_LANDSCAPE_16_9.jpg,https://s1.ticketm.net/dam/c/f51/ee785ed6-f806-4195-98f4-69f67e09df51_106201_CUSTOM.jpg,https://s1.ticketm.net/dam/c/f51/ee785ed6-f806-4195-98f4-69f67e09df51_106201_RECOMENDATION_16_9.jpg,https://s1.ticketm.net/dam/c/f51/ee785ed6-f806-4195-98f4-69f67e09df51_106201_RETINA_PORTRAIT_16_9.jpg,https://s1.ticketm.net/dam/c/f51/ee785ed6-f806-4195-98f4-69f67e09df51_106201_TABLET_LANDSCAPE_LARGE_16_9.jpg",https://www.ticketmaster.com/event/Z7r9jZ1A703pZ,false
