name,description,location_name,latitude,longitude,address,start_time,end_time,city,primary_category,secondary_categories,thumbnail_image,additional_images,external_link,is_paid
INKwell Times Sq Harbor Club Independence Celebration Afterwork,,The INKwell Harbor-Club Rooftop,40.76418434,-73.99751398,621 W 46th Street,2026-07-03T21:00:00Z,2026-07-04T03:00:00Z,new york,,,https://images.universe.com/5b28e3f6-cd74-40e1-9639-ae94d6a59b88/-/format/jpeg/-/scale_crop/1024x683/center/-/progressive/yes/-/inline/yes/,"https://s1.ticketm.net/dam/c/8cf/a6653880-7899-4f67-8067-1f95f4d158cf_124761_RETINA_LANDSCAPE_16_9.jpg,https://images.universe.com/5b28e3f6-cd74-40e1-9639-ae94d6a59b88/-/format/jpeg/-/scale_crop/640x427/center/-/progressive/yes/-/inline/yes/,https://images.universe.com/5b28e3f6-cd74-40e1-9639-ae94d6a59b88/-/format/jpeg/-/scale_crop/1024x576/center/-/progressive/yes/-/inline/yes/,https://images.universe.com/5b28e3f6-cd74-40e1-9639-ae94d6a59b88/-/format/jpeg/-/scale_crop/305x225/center/-/progressive/yes/-/inline/yes/,https://s1.ticketm.net/dam/c/8cf/a6653880-7899-4f67-8067-1f95f4d158cf_124761_EVENT_DETAIL_PAGE_16_9.jpg,https://s1.ticketm.net/dam/c/8cf/a6653880-7899-4f67-8067-1f95f4d158cf_124761_RETINA_PORTRAIT_16_9.jpg,https://s1.ticketm.net/dam/c/8cf/a6653880-7899-4f67-8067-1f95f4d158cf_124761_TABLET_LANDSCAPE_LARGE_16_9.jpg,https://images.universe.com/5b28e3f6-cd74-40e1-9639-ae94d6a59b88/-/format/jpeg/-/scale_crop/305x203/center/-/progressive/yes/-/inline/yes/,https://s1.ticketm.net/dam/c/8cf/a6653880-7899-4f67-8067-1f95f4d158cf_124761_RECOMENDATION_16_9.jpg",https://www.universe.com/events/inkwell-times-sq-harbor-club-independence-celebration-afterwork-tickets-Y2CGXV?ref=ticketmaster,false
  Live Band Country Karaoke,,Lucinda's,40.728329,-73.982199,169 Avenue A,2026-07-04T00:00:00Z,2026-07-04T03:30:00Z,new york,Music,Country,https://s1.ticketm.net/dam/c/677/c58dd0af-cda8-49b2-bdaf-068540c3a677_106541_RETINA_PORTRAIT_3_2.jpg,"https://s1.ticketm.net/dam/c/677/c58dd0af-cda8-49b2-bdaf-068540c3a677_106541_EVENT_DETAIL_PAGE_16_9.jpg,https://i.ticketweb.com/i/00/13/58/12/53_Edp.jpg?v=4,https://s1.ticketm.net/dam/c/677/c58dd0af-cda8-49b2-bdaf-068540c3a677_106541_TABLET_LANDSCAPE_3_2.jpg,https://s1.ticketm.net/dam/c/677/c58dd0af-cda8-49b2-bdaf-068540c3a677_106541_CUSTOM.jpg,https://s1.ticketm.net/dam/c/677/c58dd0af-cda8-49b2-bdaf-068540c3a677_106541_RETINA_PORTRAIT_16_9.jpg,https://s1.ticketm.net/dam/c/677/c58dd0af-cda8-49b2-bdaf-068540c3a677_106541_RECOMENDATION_16_9.jpg,https://s1.ticketm.net/dam/c/677/c58dd0af-cda8-49b2-bdaf-068540c3a677_106541_RETINA_LANDSCAPE_16_9.jpg,https://s1.ticketm.net/dam/c/677/c58dd0af-cda8-49b2-bdaf-068540c3a677_106541_TABLET_LANDSCAPE_16_9.jpg,https://s1.ticketm.net/dam/c/677/c58dd0af-cda8-49b2-bdaf-068540c3a677_106541_ARTIST_PAGE_3_2.jpg,https://s1.ticketm.net/dam/c/677/c58dd0af-cda8-49b2-bdaf-068540c3a677_106541_TABLET_LANDSCAPE_LARGE_16_9.jpg",https://www.ticketweb.com/event/-live-band-country-lucindas-tickets/14976623,true
Christian Sands Quartet,"Christian Sands Steinway Artist and Grammy Nominee is an emerging jazz force. His abundant piano technique perfectly matches his conception, accomplishing a much deeper musical goal: a fresh look at the entire language of jazz. Christian says, My music is about teaching the way of jazz and keeping it alive. Whether its stride, swing, bebop, progressive, fusion, Brazilian or Afro-Cuban, Sands develops the past while providing unusual and stimulating vehicles for the present and for the future. He expresses himself through an extensive vocabulary of patterns, textures and structures, all the while maintaining a strong sense of understatement, sensitivity, taste and swing hallmarks for as long as he has been playing.From a very early age, Christian possessed an insatiable appetite for music. He was enrolled in music classes at age 4 and wrote his first composition at age 5. He started playing professionally at the age of 10, and studied at the Neighborhood Music School and the Educational Center for the Arts in New Haven, CT. He received his Bachelor of Arts and Masters of Arts degrees from the Manhattan School of Music. For his participation on the MSM Kenya Revisited album, Sands received a Grammy Nomination for Best Latin Piano Solo.Since arriving on the scene, Sands has shared the stage with many jazz luminaries as Wynton Marsalis, Diane Reeves, Shelia E, Warren Wolf, Tia Fuller, Gary Burton, Stefan Harris, Teri Lynne Carrington, Jason Moran, Geri Allen, James Moody, Bill Evans (sax), Russell Malone, Terrance Blanchard, Louis Hayes, Patti Austin, Kurt Elling and Dee Dee Bridgewater. He served as the Creative Ambassador for the Erroll Garner foundation, Artist in Residence for Jazz in July Education program at University of Massachusetts, Artist in Residence for Monterey Jazz Festival for 2020-2022 he was the Creative Director for the Monterey Festival Band on Tour 2022-2023.Christian provides a soulful melodic touch on S. Epatha Merkersons documentary, Contradictions of Fairhope, a soundtrack recorded with McBride and a melodic piano introduction to Netflixs Biopic documentary Rustin of which he recorded with Branford Marsalis. He was named one of the future rising stars by Wynton Marsalis in Jet Magazine. Vanity Fairs Jazz Youth-Quake also named him as a future jazz star. He was finalist for the 2015 Cole Porter Jazz Fellowship Award sponsored by the America Pianist Association. Just embarking on his 30s, Sands has already enjoyed a remarkable career trajectory including a 2013 Grammy nomination with renowned Bassist Christian McBride and 2021 Grammy Nomination for Best Jazz Instrumental Composition and 52nd Annual NAACP Image Award Nominee for Outstanding Jazz Album Instrumental for his third album Be Water recording for Mack Avenue Records. His music has taken him to many international stages. In 2023 he received CHEVALIER DE LORDRE DES ARTS ET DES LETTRES, rank of Knight of the Order of Arts and Letters, from France Minister of Culture.",Birdland Jazz Club,40.7590167,-73.9896861,315 West 44th Street ,2026-07-04T02:30:00Z,2026-07-04T03:45:00Z,new york,Music,Jazz,https://s1.ticketm.net/dam/c/bea/03d47f66-d37b-4aca-aa17-0135be64dbea_105801_RETINA_PORTRAIT_16_9.jpg,"https://s1.ticketm.net/dam/c/bea/03d47f66-d37b-4aca-aa17-0135be64dbea_105801_RETINA_LANDSCAPE_16_9.jpg,https://s1.ticketm.net/dam/c/bea/03d47f66-d37b-4aca-aa17-0135be64dbea_105801_EVENT_DETAIL_PAGE_16_9.jpg,https://s1.ticketm.net/dam/c/bea/03d47f66-d37b-4aca-aa17-0135be64dbea_105801_RECOMENDATION_16_9.jpg,https://i.ticketweb.com/i/00/13/39/05/53_Edp.jpg?v=3,https://s1.ticketm.net/dam/c/bea/03d47f66-d37b-4aca-aa17-0135be64dbea_105801_ARTIST_PAGE_3_2.jpg,https://s1.ticketm.net/dam/c/bea/03d47f66-d37b-4aca-aa17-0135be64dbea_105801_TABLET_LANDSCAPE_3_2.jpg,https://s1.ticketm.net/dam/c/bea/03d47f66-d37b-4aca-aa17-0135be64dbea_105801_CUSTOM.jpg,https://s1.ticketm.net/dam/c/bea/03d47f66-d37b-4aca-aa17-0135be64dbea_105801_TABLET_LANDSCAPE_16_9.jpg,https://s1.ticketm.net/dam/c/bea/03d47f66-d37b-4aca-aa17-0135be64dbea_105801_TABLET_LANDSCAPE_LARGE_16_9.jpg",https://www.ticketweb.com/event/christian-sands-quartet-birdland-jazz-club-tickets/14787593,true
Radio City Music Hall Tour Experience,"* 14 ticket limit per order. All sales are final - no refunds or exchanges. Discount code only applies to full-priced Adult tickets for select tours purchased on Ticketmaster.com. Offer not valid on not valid on child, senior or group rates. Offer may not be combined with any other offer or used on previously purchased tickets. Offer may be revoked or modified at any time without notice. Tour content, prices, dates and times are subject to change. Tour and Rockette are each subject to availability. Service charges apply to internet orders. Other restrictions may apply. If special accommodations are needed please call 212-465-6115 after ticket purchase. Radio City Music Hall and Stage Door are trademarks of MSG Holdings, L.P. or its affiliates.",Radio City Music Hall Tour Experience,40.75997700,-73.97997500,1260 Avenue of the Americas,,,new york,Miscellaneous,Undefined,https://s1.ticketm.net/dam/a/ad0/0c879104-ba01-492c-846f-379581c53ad0_RETINA_LANDSCAPE_16_9.jpg,"https://s1.ticketm.net/dam/a/ad0/0c879104-ba01-492c-846f-379581c53ad0_TABLET_LANDSCAPE_16_9.jpg,https://s1.ticketm.net/dam/a/ad0/0c879104-ba01-492c-846f-379581c53ad0_RECOMENDATION_16_9.jpg,https://s1.ticketm.net/dam/a/ad0/0c879104-ba01-492c-846f-379581c53ad0_CUSTOM.jpg,https://s1.ticketm.net/dam/a/ad0/0c879104-ba01-492c-846f-379581c53ad0_EVENT_DETAIL_PAGE_16_9.jpg,https://s1.ticketm.net/dam/a/ad0/0c879104-ba01-492c-846f-379581c53ad0_ARTIST_PAGE_3_2.jpg,https://s1.ticketm.net/dam/a/ad0/0c879104-ba01-492c-846f-379581c53ad0_RETINA_PORTRAIT_3_2.jpg,https://s1.ticketm.net/dam/a/ad0/0c879104-ba01-492c-846f-379581c53ad0_TABLET_LANDSCAPE_3_2.jpg,https://s1.ticketm.net/dam/a/ad0/0c879104-ba01-492c-846f-379581c53ad0_RETINA_PORTRAIT_16_9.jpg,https://s1.ticketm.net/dam/a/ad0/0c879104-ba01-492c-846f-379581c53ad0_TABLET_LANDSCAPE_LARGE_16_9.jpg,https://s1.ticketm.net/dam/a/ad0/0c879104-ba01-492c-846f-379581c53ad0_SOURCE",https://www.ticketmaster.com/radio-city-music-hall-tour-experience-new-york-new-york-07-03-2026/event/3C00645A087A2356,false
Madison Square Garden Tour Experience,,Madison Square Garden,40.74970620,-73.99160060,7th Ave & 32nd Street,,,new york,Miscellaneous,Undefined,https://s1.ticketm.net/dam/a/476/7c230b41-d92a-4fd4-b6d1-dc6951ae8476_ARTIST_PAGE_3_2.jpg,"https://s1.ticketm.net/dam/a/476/7c230b41-d92a-4fd4-b6d1-dc6951ae8476_RETINA_PORTRAIT_16_9.jpg,https://s1.ticketm.net/dam/a/476/7c230b41-d92a-4fd4-b6d1-dc6951ae8476_RETINA_PORTRAIT_3_2.jpg,https://s1.ticketm.net/dam/a/476/7c230b41-d92a-4fd4-b6d1-dc6951ae8476_TABLET_LANDSCAPE_3_2.jpg,https://s1.ticketm.net/dam/a/476/7c230b41-d92a-4fd4-b6d1-dc6951ae8476_CUSTOM.jpg,https://s1.ticketm.net/dam/a/476/7c230b41-d92a-4fd4-b6d1-dc6951ae8476_SOURCE,https://s1.ticketm.net/dam/a/476/7c230b41-d92a-4fd4-b6d1-dc6951ae8476_RECOMENDATION_16_9.jpg,https://s1.ticketm.net/dam/a/476/7c230b41-d92a-4fd4-b6d1-dc6951ae8476_EVENT_DETAIL_PAGE_16_9.jpg,https://s1.ticketm.net/dam/a/476/7c230b41-d92a-4fd4-b6d1-dc6951ae8476_TABLET_LANDSCAPE_LARGE_16_9.jpg,https://s1.ticketm.net/dam/a/476/7c230b41-d92a-4fd4-b6d1-dc6951ae8476_RETINA_LANDSCAPE_16_9.jpg,https://s1.ticketm.net/dam/a/476/7c230b41-d92a-4fd4-b6d1-dc6951ae8476_TABLET_LANDSCAPE_16_9.jpg",https://www.ticketmaster.com/madison-square-garden-tour-experience-new-york-new-york-07-03-2026/event/3B0062F8B0B711F6,false
Museum of Chinese in America Flex Admission,,Museum of Chinese in America,40.71953297,-73.99902914,215 Centre Street,2026-04-29T15:00:00Z,2026-12-31T23:00:00Z,new york,Miscellaneous,Undefined,https://s1.ticketm.net/dam/c/03e/e15ef00f-2c87-4421-ae61-d740851a703e_105891_RETINA_LANDSCAPE_16_9.jpg,"https://images.universe.com/87c12cd6-3143-4efa-9b0f-29b4ebc9321d/-/resize/1200x/-/crop/791x791/105,4/-/format/jpeg/-/scale_crop/1024x683/center/-/progressive/yes/-/inline/yes/,https://s1.ticketm.net/dam/c/03e/e15ef00f-2c87-4421-ae61-d740851a703e_105891_EVENT_DETAIL_PAGE_16_9.jpg,https://s1.ticketm.net/dam/c/03e/e15ef00f-2c87-4421-ae61-d740851a703e_105891_RETINA_PORTRAIT_16_9.jpg,https://images.universe.com/87c12cd6-3143-4efa-9b0f-29b4ebc9321d/-/resize/1200x/-/crop/791x791/105,4/-/format/jpeg/-/scale_crop/1024x576/center/-/progressive/yes/-/inline/yes/,https://images.universe.com/87c12cd6-3143-4efa-9b0f-29b4ebc9321d/-/resize/1200x/-/crop/791x791/105,4/-/format/jpeg/-/scale_crop/640x427/center/-/progressive/yes/-/inline/yes/,https://s1.ticketm.net/dam/c/03e/e15ef00f-2c87-4421-ae61-d740851a703e_105891_RECOMENDATION_16_9.jpg,https://images.universe.com/87c12cd6-3143-4efa-9b0f-29b4ebc9321d/-/resize/1200x/-/crop/791x791/105,4/-/format/jpeg/-/scale_crop/305x225/center/-/progressive/yes/-/inline/yes/,https://images.universe.com/87c12cd6-3143-4efa-9b0f-29b4ebc9321d/-/resize/1200x/-/crop/791x791/105,4/-/format/jpeg/-/scale_crop/305x203/center/-/progressive/yes/-/inline/yes/,https://s1.ticketm.net/dam/c/03e/e15ef00f-2c87-4421-ae61-d740851a703e_105891_TABLET_LANDSCAPE_LARGE_16_9.jpg",https://www.universe.com/events/museum-of-chinese-in-america-flex-admission-tickets-B9N1ZL?ref=ticketmaster,false
